{"specification_id":"MWM-CPR-SPEC","run_id":"CPR-RUN-EXAMPLE-001","chapter_id":"CH-EXAMPLE","volume_id":"VOL-EXAMPLE","version_id":"v1","stage":"intake","profile_id":"MWM-CP-EXAMPLE","summary":{"component_count":1,"file_count":1,"missing_count":0,"blocked_count":0,"tracked_count":1,"not_applicable_count":2,"upstream_blocker_count":0,"release_recommendation":"ready_with_tracked_items"},"components":[{"component_id":"CPR-CMP-EXAMPLE-TITLE","component_type":"title","label":"Chapter title","requiredness":"required","applicability":"applicable","applicability_condition":null,"applicability_rationale":null,"applicability_authority":null,"status":"complete","stage_due":"intake","source_or_file":"chapter.docx:title","linked_components":[],"owner":"volume editor","evidence":["CPR-E-EXAMPLE-TITLE"],"dependency_ids":[],"release_effect":"none","last_checked":"2026-08-13T00:00:00Z"}],"files":[{"file_id":"CPR-F-EXAMPLE-MANUSCRIPT","path_or_uri":"chapter-v1.docx","filename":"chapter-v1.docx","extension":"docx","version_id":"v1","declared_purpose":"current clean manuscript","status":"current","clean_state":"clean","hash_or_stable_id":"sha256:example","supersedes":null,"evidence_id":"CPR-E-EXAMPLE-TITLE","owner":"production coordinator","last_modified":"2026-08-13T00:00:00Z"}],"findings":[],"upstream_statuses":[{"skill_id":"RCI","run_id":"RCI-RUN-EXAMPLE","status":"not_run","not_run_reason":"intake","finding_ids":[],"owner":"RCI owner","severity":null,"release_effect":"track","response_status":"not_required","evidence_locator":null}],"ledger":{"ledger_id":"CPR-LEDGER-EXAMPLE-001","run_id":"CPR-RUN-EXAMPLE-001","chapter_id":"CH-EXAMPLE","version_id":"v1","stage":"intake","open_finding_ids":[],"tracked_finding_ids":["CPR-FND-EXAMPLE-LATER"],"resolved_finding_ids":[],"blocked_count":0,"upstream_blocker_count":0,"not_applicable_count":2,"release_recommendation":"ready_with_tracked_items","owner_groups":["author","volume editor"],"created_at":"2026-08-13T00:00:00Z","supersedes":null},"decision":{"decision_id":"CPR-DEC-EXAMPLE-001","run_id":"CPR-RUN-EXAMPLE-001","chapter_id":"CH-EXAMPLE","version_id":"v1","stage":"intake","recommendation":"ready_with_tracked_items","finding_ids":["CPR-FND-EXAMPLE-LATER"],"evidence_summary":"Required intake components are complete; biography is due at release.","rationale":"Current-stage gates pass and the later-stage item has an owner.","conditions":[],"signatory_role":"volume editor","signatory":null,"signed_at":null,"status":"recommendation_only","supersedes":null,"created_at":"2026-08-13T00:00:00Z"},"generated_at":"2026-08-13T00:00:00Z"}
